"ID";"First_author";"Published";"Title";"Journal";"Species"
981;"Yue, P";2017,00;"Intranasal Administration of GDNF Protects Against Neural Apoptosis in a Rat Model of Parkinson's Disease Through PI3K/Akt/GSK3beta Pathway.";47;"Rat"
982;"Yurek, DM";1989,00;"Morphological, neurochemical, and behavioral characterizations associated with the combined treatment of diethyldithiocarbamate and 1-methyl-4-phenyl-1,2,3,6-tetrahydropyridine in mice.";21;"Mouse"
983;"Zagon, IS";1994,00;"Preproenkephalin mRNA expression in the developing and adult rat brain.";21;"Rat"
984;"Zahm, DS";2001,00;"Neurons of origin of the neurotensinergic plexus enmeshing the ventral tegmental area in rat: retrograde labeling and in situ hybridization combined.";11;"Rat"
985;"Zahm, DS";1998,00;"Distinct and interactive effects of d-amphetamine and haloperidol on levels of neurotensin and its mRNA in subterritories in the dorsal and ventral striatum of the rat.";12;"Rat"
986;"Zahm, DS";1988,00;"Ventral striatopallidal parts of the basal ganglia in the rat: I. Neurochemical compartmentation as reflected by the distributions of neurotensin and substance P immunoreactivity.";12;"Rat"
987;"Zakhary, S";2010,00;"Distribution analysis of deacetylase SIRT1 in rodent and human nervous systems.";146;"Rodent"
988;"Zhang, A";2012,00;"Protective effects of VEGF treatment on focal cerebral ischemia in rats.";221;"Rat"
989;"Zhang, C";2017,00;"A platform for stereological quantitative analysis of the brain-wide distribution of type-specific neurons.";171;"Mouse"
990;"Zhang, QW";2013,00;"Exercise promotes axon regeneration of newborn striatonigral and corticonigral projection neurons in rats after ischemic stroke.";13;"Rat"
991;"Zhang, ZN";2017,00;"Subcutaneous rotenone rat model of Parkinson's disease: Dose exploration study.";21;"Rat"
992;"Zhao, BT";2012,00;"[Changes of BDNF expression in neurons in traumatic brain injury rats]. [Chinese]";;
993;"Zhao, F";2002,00;"Ultrastructural and MRI study of the substantia nigra evolving exofocal post-ischemic neuronal death in the rat.";119;"Rat"
994;"Zheng, JS";2005,00;"Delayed gene therapy of glial cell line-derived neurotrophic factor is efficacious in a rat model of Parkinson's disease.";21;"Rat"
995;"Zheng, L";2014,00;"[Protective effect of alkaloids from Piper longum in rat dopaminergic neuron injury of 6-OHDA-induced Parkinson's disease]. [Chinese]";;
996;"Zheng, LF";2013,00;"Alterations in TH- and ChAT-immunoreactive neurons in the DMV and gastric dysmotility in an LPS-induced PD rat model.";222;"Rat"
997;"Zheng, X";2018,00;"A Comparative study for striatal-direct and -indirect pathway neurons to DA depletion-induced lesion in a PD rat model.";86;"Rat"
998;"Zhou, HX";2017,00;"Preventive and therapeutic effect of simvastatin on secondary inflammatory damage of rats with cerebral hemorrhage.";223;"Rat"
999;"Zhou, J";1994,00;"The response of human and rat fetal ventral mesencephalon in culture to the brain-derived neurotrophic factor treatment.";21;"Rat"
1000;"Zhou, X";2016,00;"Effect of the sonic hedgehog receptor smoothened on the survival and function of dopaminergic neurons.";18;"Mouse"
1001;"Zhou, XF";1994,00;"Localization of neurotrophin-3-like immunoreactivity in the rat central nervous system.";21;"Rat"
1002;"Zhou, ZW";2011,00;"The glutaminergic, GABAergic, dopaminergic but not cholinergic neurons are susceptible to anaesthesia-induced cell death in the rat developing brain.";11;"Rat"
1003;"Zhu, HC";2012,00;"Gastrointestinal dysfunction in a Parkinson's disease rat model and the changes of dopaminergic, nitric oxidergic, and cholinergic neurotransmitters in myenteric plexus.[Erratum appears in J Mol Neurosci. 2012 May;47(1):206]";79;"Rat"
1004;"Zhu, WW";2005,00;"[Effect of the oil from ganoderma lucidum spores on pathological changes in the substantia nigra and behaviors of MPTP-treated mice]. [Chinese]";;
1005;"Zimatkin, SM";1994,00;"[Regional and cellular distribution of mitochondrial high-affinity aldehyde dehydrogenase in the rat brain (an immunocytochemical study)]. [Russian]";;
1006;"Zimmer, J";1984,00;"Neuropeptides and astroglia in intracerebral hippocampal transplants: an immunohistochemical study in the rat.";12;"Rat"
1007;"Zoli, M";1990,00;"Morphometrical and microdensitometrical studies on peptide- and tyrosine hydroxylase-like immunoreactivities in the forebrain of rats prenatally exposed to methylazoxymethanol acetate.";21;"Rat"
1008;"Zorio, DA";2017,00;"Cellular distribution of the fragile X mental retardation protein in the mouse brain.";12;"Mouse"
1010;"Acosta, SA";0,00;"Alpha-synuclein as a pathological link between chronic traumatic brain injury and Parkinson's disease.";224;"Rat"
1011;"Aguirre, JA";0,00;"Protection but maintained dysfunction of nigral dopaminergic nerve cell bodies and striatal dopaminergic terminals in MPTP-lesioned mice after acute treatment with the mGluR5 antagonist MPEP.";21;"Mouse"
1012;"Aguirre, JA";0,00;"Group I mGluR antagonist AIDA protects nigral DA cells from MPTP-induced injury.";142;"Mouse"
1013;"Ahmad, SO";0,00;"Reduced numbers of dopamine neurons in the substantia nigra pars compacta and ventral tegmental area of rats fed an n-3 polyunsaturated fatty acid-deficient diet: a stereological study.";8;"Rat"
1014;"Akkhawattanangkul, Y";0,00;"Targeted deletion of GD3 synthase protects against MPTP-induced neurodegeneration.";147;"Mouse"
1015;"Alam, G";0,00;"Single low doses of MPTP decrease tyrosine hydroxylase expression in the absence of overt neuron loss.";66;"Mouse"
1016;"Arcuri, L";0,00;"Genetic and pharmacological evidence that endogenous nociceptin/orphanin FQ contributes to dopamine cell loss in Parkinson's disease.";68;"Mouse"
1017;"Arvidsson, A";0,00;"Elevated GDNF levels following viral vector-mediated gene transfer can increase neuronal death after stroke in rats.";68;"Rat"
1018;"Baquet, ZC";0,00;"Brain-derived neurotrophic factor is required for the establishment of the proper number of dopaminergic neurons in the substantia nigra pars compacta.";7;"Mouse"
1019;"Barkholt, P";0,00;"Long-term polarization of microglia upon alpha-synuclein overexpression in nonhuman primates.";11;"Monkey"
1020;"Barlow, BK";0,00;"A fetal risk factor for Parkinson's disease.";91;"Mouse"
1021;"Bastide, MF";2012,00;"Immediate-early gene expression in structures outside the basal ganglia is associated to l-DOPA-induced dyskinesia.";68;"Rat"
1022;"Bayliss, JA";0,00;"Ghrelin-AMPK Signaling Mediates the Neuroprotective Effects of Calorie Restriction in Parkinson's Disease.";7;"Mouse"
1023;"Becker, B";0,00;"Effect of Intrastriatal 6-OHDA Lesions on Extrastriatal Brain Structures in the Mouse.";158;"Mouse"
1024;"Berghauzen-Maciejewska";0,00;"Adaptive down-regulation of the serotonin transporter in the 6-hydroxydopamine-induced rat model of preclinical stages of Parkinson's disease and after chronic pramipexole treatment.";11;"Rat"
1025;"Bhaduri, B";0,00;"Baseline striatal and nigral interneuronal protein levels in two distinct mice strains differ in accordance with their MPTP susceptibility.";14;"Mouse"
1026;"Canudas, AM";2000,00;"MPP(+) injection into rat substantia nigra causes secondary glial activation but not cell death in the ipsilateral striatum.";68;"Rat"
1027;"Cao, F";0,00;"Fcgamma receptors are required for NF-kappaB signaling, microglial activation and dopaminergic neurodegeneration in an AAV-synuclein mouse model of Parkinson's disease.";138;"Mouse"
1028;"Chadi, G";0,00;"Adrenalectomy counteracts the local modulation of astroglial fibroblast growth factor system without interfering with the pattern of 6-OHDA-induced dopamine degeneration in regions of the ventral midbrain.";21;"Rat"
1029;"Champy, P";0,00;"Annonacin, a lipophilic inhibitor of mitochondrial complex I, induces nigral and striatal neurodegeneration in rats: possible relevance for atypical parkinsonism in Guadeloupe.";46;"Rat"
1030;"Chan, P";0,00;"(+)MK-801 does not prevent MPTP-induced loss of nigral neurons in mice.";212;"Mouse"
1031;"Chu, Y";0,00;"Abnormal alpha-synuclein reduces nigral voltage-dependent anion channel 1 in sporadic and experimental Parkinson's disease.";68;"Rat"
1032;"Dai, Y";0,00;"Somatic mitochondrial DNA mutations do not increase neuronal vulnerability to MPTP in young POLG mutator mice.";19;"Mouse"
1033;"Davis, BJ";0,00;"Alterations of pancreatic islet size and growth following substantia nigra lesions in the rat.";225;"Rat"
1034;"Dela Cruz, JA";0,00;"Differential distribution of hypoxia-inducible factor 1-beta (ARNT or ARNT2) in mouse substantia nigra and ventral tegmental area.";14;"Mouse"
1035;"Egami, K";0,00;"Basal ganglia dopamine loss due to defect in purine recycling.";68;"Mouse"
1036;"Elgueta, D";0,00;"Pharmacologic antagonism of dopamine receptor D3 attenuates neurodegeneration and motor impairment in a mouse model of Parkinson's disease.";59;"Mouse"
1037;"Erisgin, Z";0,00;"The neurotoxic effects of prenatal gabapentin and oxcarbazepine exposure on newborn rats.";226;"Rat"
1038;"Finkelstein, DI";0,00;"Quantified assessment of terminal density and innervation.";161;
1039;"Fischer, DL";0,00;"High-Frequency Stimulation of the Rat Entopeduncular Nucleus Does Not Provide Functional or Morphological Neuroprotection from 6-Hydroxydopamine.";13;"Rat"
1040;"Frau, L";0,00;"Neuroprotective and anti-inflammatory effects of the adenosine A(2A) receptor antagonist ST1535 in a MPTP mouse model of Parkinson's disease.";5;"Mouse"
1041;"Gerecke, KM";0,00;"Exercise does not protect against MPTP-induced neurotoxicity in BDNF haploinsufficient mice.";13;"Mouse"
1042;"Gombash, SE";2014,00;"Neuroprotective potential of pleiotrophin overexpression in the striatonigral pathway compared with overexpression in both the striatonigral and nigrostriatal pathways.";198;"Rat"
1043;"Gomide, V";0,00;"Glial bFGF and S100 immunoreactivities increase in ascending dopamine pathways following striatal 6-OHDA-induced partial lesion of the nigrostriatal system: a sterological analysis.";61;"Rat"
1044;"Gomide, V";0,00;"Transient and widespread astroglial activation in the brain after a striatal 6-OHDA-induced partial lesion of the nigrostriatal system.";61;"Rat"
1045;"Gonzalez-Aparicio, R";0,00;"Mice lacking the peroxisome proliferator-activated receptor alpha gene present reduced number of dopamine neurons in the substantia nigra without altering motor behavior or dopamine neuron decline over life.";11;"Mouse"
1046;"Goit, D";0,00;"A mutant ataxin-3 putative-cleavage fragment in brains of Machado-Joseph disease patients and transgenic mice is cytotoxic above a critical concentration.";7;"Mouse"
1047;"Gramsbergen, JB";0,00;"Glutathione depletion in nigrostriatal slice cultures: GABA loss, dopamine resistance and protection by the tetrahydrobiopterin precursor sepiapterin.";21;"Rat"
1048;"Grieb, B";0,00;"Decomposition of abnormal free locomotor behavior in a rat model of Parkinson's disease.";227;"Rat"
1049;"Gross, CE";0,00;"Pattern of levodopa-induced striatal changes is different in normal and MPTP-lesioned mice.";46;"Mouse"
1050;"Hansen, HH";0,00;"Characterization of liraglutide, a glucagon-like peptide-1 (GLP-1) receptor agonist, in rat partial and full nigral 6-hydroxydopamine lesion models of Parkinson's disease.";21;"Rat"
1051;"He, Y";0,00;"Minocycline inhibits microglial activation and protects nigral cells after 6-hydroxydopamine injection into mouse striatum.";21;"Mouse"
1052;"Healy-Stoffel, M";0,00;"Differential effects of intrastriatal 6-hydroxydopamine on cell number and morphology in midbrain dopaminergic subregions of the rat.";21;"Rat"
1053;"Healy-Stoffel, M";0,00;"Altered nucleolar morphology in substantia nigra dopamine neurons following 6-hydroxydopamine lesion in rats.";8;"Rat"
1054;"Hennis, MR";0,00;"Surprising behavioral and neurochemical enhancements in mice with combined mutations linked to Parkinson's disease.";68;"Mouse"
1055;"Hermann, A";0,00;"Lack of vascular endothelial growth factor receptor-2/Flk1 signaling does not affect substantia nigra development.";8;"Mouse"
1056;"Hormigo, S";0,00;"Direct and indirect nigrofugal projections to the nucleus reticularis pontis caudalis mediate in the motor execution of the acoustic startle reflex.";22;"Rat"
1057;"Horvath, TL";0,00;"GPA protects the nigrostriatal dopamine system by enhancing mitochondrial function";68;"Mouse"
1058;"Hu, J";0,00;"Dynamic alterations of gene expression of nicotinic acetylcholine receptor alpha7, alpha4 and beta2 subunits in an acute MPTP-lesioned mouse model.";8;"Mouse"
1059;"Ikzkiewicz, J";0,00;"The RGD-containing peptide fragment of osteopontin protects tyrosine hydroxylase positive cells against toxic insult in primary ventral mesencephalic cultures and in the rat substantia nigra.";46;"Rat"
1060;"Ip, CW";0,00;"Stereological Estimation of Dopaminergic Neuron Number in the Mouse Substantia Nigra Using the Optical Fractionator and Standard Microscopy Equipment.";228;"Mouse"
1061;"Janis, KL";0,00;"Effects of sildenafil on nigrostriatal dopamine neurons in a murine model of Parkinson's disease.";229;"Mouse"
1062;"Johnson, ML";0,00;"Oestrogen receptors enhance dopamine neurone survival in rat midbrain.";53;"Rat"
1063;"Johnson, ML";0,00;"Androgen decreases dopamine neurone survival in rat midbrain.";53;"Rat"
1064;"Joyce, JN";0,00;"Low dose pramipexole is neuroprotective in the MPTP mouse model of Parkinson's disease, and downregulates the dopamine transporter via the D3 receptor.";31;"Mouse"
1065;"Kachroo, A";0,00;"Caffeine protects against combined paraquat and maneb-induced dopaminergic neuron degeneration.";18;"Mouse"
1066;"Kang, WY";0,00;"Migratory defect of mesencephalic dopaminergic neurons in developing reeler mice.";230;"Mouse"
1067;"Karuppagounder, SS";0,00;"LRRK2 G2019S transgenic mice display increased susceptibility to 1-methyl-4-phenyl-1,2,3,6-tetrahydropyridine (MPTP)-mediated neurotoxicity.";14;"Mouse"
1068;"Kim, SY";0,00;"Striatal-enriched protein tyrosine phosphatase regulates dopaminergic neuronal development via extracellular signal-regulated kinase signaling.";18;"Mouse"
1069;"Kincaid, AE";0,00;"Spontaneous circling behavior and dopamine neuron loss in a genetically hypothyroid mouse.";11;"Mouse"
1070;"Kneynsberg, A";0,00;"Quantitative and semi-quantitative measurements of axonal degeneration in tissue and primary neuron cultures.";7;"Rat"
1071;"Kolasiewicz, W";0,00;"6-OHDA injections into A8-A9 dopaminergic neurons modelling early stages of Parkinson's disease increase the harmaline-induced tremor in rats.";21;"Rat"
1072;"Kollensperger, M";0,00;"Erythropoietin is neuroprotective in a transgenic mouse model of multiple system atrophy.";58;"Mouse"
1073;"Komnig, D";0,00;"Mice lacking Faim2 show increased cell death in the MPTP mouse model of Parkinson disease.";46;"Mouse"
1074;"Komnig, D";0,00;"ASIC1a Deficient Mice Show Unaltered Neurodegeneration in the Subacute MPTP Model of Parkinson Disease.";13;"Mouse"
1075;"Konieczny, J";0,00;"Decreased behavioral response to intranigrally administered GABAA agonist muscimol in the lactacystin model of Parkinson's disease may result from partial lesion of nigral non-dopamine neurons: comparison to the classical neurotoxin 6-OHDA.";55;"Rat"
1076;"Koprich, JB";0,00;"Neuroinflammation mediated by IL-1beta increases susceptibility of dopamine neurons to degeneration in an animal model of Parkinson's disease.";4;"Rat"
1077;"Kordower, JH";0,00;"Lentiviral gene transfer to the nonhuman primate brain.";18;"Monkey"
1078;"L'Episcopo, F";0,00;"Combining nitric oxide release with anti-inflammatory activity preserves nigrostriatal dopaminergic innervation and prevents motor impairment in a 1-methyl-4-phenyl-1,2,3,6-tetrahydropyridine model of Parkinson's disease.";4;"Mouse"
1079;"Lecca, D";0,00;"Neuroprotective and anti-inflammatory properties of a novel non-thiazolidinedione PPARgamma agonist in vitro and in MPTP-treated mice.";11;"Mouse"
1080;"Lee, DW";0,00;"Subchronic polychlorinated biphenyl (Aroclor 1254) exposure produces oxidative damage and neuronal death of ventral midbrain dopaminergic systems.";145;"Mouse"
1081;"Lee, JK";0,00;"Regulator of G-protein signaling 10 promotes dopaminergic neuron survival via regulation of the microglial inflammatory response.";7;"Mouse"
1082;"Li, R";0,00;"Epigallocatechin gallate protects dopaminergic neurons against 1-methyl-4- phenyl-1,2,3,6-tetrahydropyridine-induced neurotoxicity by inhibiting microglial cell activation.";;
1083;"Lieb, K";0,00;"Pre- and postnatal development of dopaminergic neuron numbers in the male and female mouse midbrain.";21;"Mouse"
1084;"Lie, FL";0,00;"Acute intermittent nicotine treatment produces a reduction in the total number of FGF-2 immunoreactive astroglial cells in the substantia nigra of the rat: a stereological analysis.";8;"Rat"
1085;"Lorenc-Koci, E";0,00;"The influence of acute and chronic administration of 1,2-dimethyl-6,7-dihydroxy-1,2,3,4-tetrahydroisoquinoline on the function of the nigrostriatal dopaminergic system in rats.";11;"Rat"
1086;"Lorenc-Koci, E";0,00;"Parkinson's disease-like syndrome in rats induced by 2,9-dimethyl-beta-carbolinium ion, a beta-carboline occurring in the human brain.";231;"Rat"
1087;"Lu, XH";0,00;"Bacterial artificial chromosome transgenic mice expressing a truncated mutant parkin exhibit age-dependent hypokinetic motor deficits, dopaminergic neuron degeneration, and accumulation of proteinase K-resistant alpha-synuclein.";7;"Mouse"
1088;"Ma, J";0,00;"Does melatonin help save dopaminergic cells in MPTP-treated mice?.";127;"Mouse"
1089;"McBride, JL";0,00;"Human neural stem cell transplants improve motor function in a rat model of Huntington's disease.";12;"Rat"
1090;"McCormack, AL";0,00;"Decreased susceptibility to oxidative stress underlies the resistance of specific dopaminergic cell populations to paraquat-induced degeneration.";11;"Mouse"
1091;"McCormack, AL";0,00;"Environmental risk factors and Parkinson's disease: selective degeneration of nigral dopaminergic neurons caused by the herbicide paraquat.";68;"Mouse"
1092;"McLeod, M";0,00;"Erythropoietin and GDNF enhance ventral mesencephalic fiber outgrowth and capillary proliferation following neural transplantation in a rodent model of Parkinson's disease.";2;"Rat"
1093;"Mendieta, L";0,00;"Fragment C Domain of Tetanus Toxin Mitigates Methamphetamine Neurotoxicity and Its Motor Consequences in Mice.";232;"Mouse"
1094;"Migdalska-Richards, A";0,00;"The L444P Gba1 mutation enhances alpha-synuclein induced loss of nigral dopaminergic neurons in mice.";165;"Mouse"
1095;"Milosevic, J";0,00;"Lack of hypoxia-inducible factor-1 alpha impairs midbrain neural precursor cells involving vascular endothelial growth factor signaling.";7;"Mouse"
1096;"Minnema, DJ";0,00;"Dietary administration of diquat for 13 weeks does not result in a loss of dopaminergic neurons in the substantia nigra of C57BL/6J mice.";233;"Mouse"
1097;"Minnema, DJ";0,00;"Dietary administration of paraquat for 13 weeks does not result in a loss of dopaminergic neurons in the substantia nigra of C57BL/6J mice.";233;"Mouse"
1098;"Morel, GR";0,00;"Cognitive impairment and morphological changes in the dorsal hippocampus of very old female rats.";11;"Rat"
1099;"Mouton, PR";0,00;"The effects of age and lipopolysaccharide (LPS)-mediated peripheral inflammation on numbers of central catecholaminergic neurons.";64;"Mouse"
1100;"Naskar, A";0,00;"Melatonin enhances L-DOPA therapeutic effects, helps to reduce its dose, and protects dopaminergic neurons in 1-methyl-4-phenyl-1,2,3,6-tetrahydropyridine-induced Parkinsonism in mice.";234;"Mouse"
1101;"Nguyen, TA";0,00;"Analysis of inflammation-related nigral degeneration and locomotor function in DJ-1(-/-) mice.";4;"Mouse"
1102;"O'Neil";0,00;"Catecholaminergic neuronal loss in locus coeruleus of aged female dtg APP/PS1 mice.";14;"Mouse"
1103;"Olson, KE";0,00;"Selective VIP Receptor Agonists Facilitate Immune Transformation for Dopaminergic Neuroprotection in MPTP-Intoxicated Mice.";7;"Mouse"
1104;"Oorschot, DE";0,00;"Total number of neurons in the neostriatal, pallidal, subthalamic, and substantia nigral nuclei of the rat basal ganglia: a stereological study using the cavalieri and optical disector methods.";12;"Rat"
1105;"Overk, CR";0,00;"Brainstem Alzheimer's-like pathology in the triple transgenic mouse model of Alzheimer's disease.";68;"Mouse"
1106;"Pabon, MM";0,00;"CX3CL1 reduces neurotoxicity and microglial activation in a rat model of Parkinson's disease.";4;"Rat"
1107;"Pang, Y";0,00;"Intranasal insulin protects against substantia nigra dopaminergic neuronal loss and alleviates motor deficits induced by 6-OHDA in rats.";11;"Rat"
1108;"Panneton, WM";0,00;"The neurotoxicity of DOPAL: behavioral and stereological evidence for its role in Parkinson disease pathogenesis.[Erratum appears in PLoS One. 2011;6(2). doi: 10.1371/annotation/819cbf4a-7e3e-4e4e-a449-b667bc6e8957]";13;"Rat"
1109;"Passos, PP";0,00;"Dopaminergic cell populations of the rat substantia nigra are differentially affected by essential fatty acid dietary restriction over two generations.";14;"Rat"
1110;"Pattarini, R";0,00;"Temporal mRNA profiles of inflammatory mediators in the murine 1-methyl-4-phenyl-1,2,3,6-tetrahydropyrimidine model of Parkinson's disease.";11;"Mouse"
1111;"Petroske, E";0,00;"Mouse model of Parkinsonism: a comparison between subacute MPTP and chronic MPTP/probenecid treatment.";11;"Mouse"
1112;"Pienaar, IS";0,00;"An animal model mimicking pedunculopontine nucleus cholinergic degeneration in Parkinson's disease.";22;"Rat"
1113;"Price, DA";0,00;"WIN55,212-2, a cannabinoid receptor agonist, protects against nigrostriatal cell loss in the 1-methyl-4-phenyl-1,2,3,6-tetrahydropyridine mouse model of Parkinson's disease.";2;"Mouse"
1114;"Quesada, A";0,00;"Distribution and localization patterns of estrogen receptor-beta and insulin-like growth factor-1 receptors in neurons and glial cells of the female rat substantia nigra: localization of ERbeta and IGF-1R in substantia nigra.";12;"Rat"
1115;"Requejo, C";0,00;"Topographical Distribution of Morphological Changes in a Partial Model of Parkinson's Disease--Effects of Nanoencapsulated Neurotrophic Factors Administration.";158;"Rat"
1116;"Richter, F";0,00;"Effects of decreased dopamine transporter levels on nigrostriatal neurons and paraquat/maneb toxicity in mice.";64;"Mouse"
1117;"Rojas, JC";0,00;"Striatal neuroprotection with methylene blue.";11;"Rat"
1118;"Sadasivan, S";0,00;"Methylphenidate exposure induces dopamine neuron loss and activation of microglia in the basal ganglia of mice.";13;"Mouse"
1119;"Sanchez, HL";0,00;"Dopaminergic mesencephalic systems and behavioral performance in very old rats.";11;"Rat"
1120;"Sanchez-Guajardo, V";0,00;"Microglia acquire distinct activation profiles depending on the degree of alpha-synuclein neuropathology in a rAAV based model of Parkinson's disease.";13;"Rat"
1121;"Schapira, AH";0,00;"Proteasomal inhibition causes loss of nigral tyrosine hydroxylase neurons.";104;"Rat"
1122;;0,00;;;
1123;"Shahaduzzaman, M";0,00;"Anti-human alpha-synuclein N-terminal peptide antibody protects against dopaminergic cell death and ameliorates behavioral deficits in an AAV-alpha-synuclein rat model of Parkinson's disease.";13;"Rat"
1124;"Shchepinov, MS";0,00;"Isotopic reinforcement of essential polyunsaturated fatty acids diminishes nigrostriatal degeneration in a mouse model of Parkinson's disease.";186;"Mouse"
1125;"Silva, C";2009,00;"Involvement of astroglial fibroblast growth factor-2 and microglia in the nigral 6-OHDA parkinsonism and a possible role of glucocorticoid hormone on the glial mediated local trophism and wound repair.";56;"Rat"
1126;"Simkins, TJ";0,00;"Comparison of the D2 receptor regulation and neurotoxicant susceptibility of nigrostriatal dopamine neurons in wild-type and CB1/CB2 receptor knockout mice.";235;"Mouse"
1127;"Smeyne, RJ";0,00;"Assessment of the Effects of MPTP and Paraquat on Dopaminergic Neurons and Microglia in the Substantia Nigra Pars Compacta of C57BL/6 Mice.";13;"Mouse"
1128;"Song, CH";0,00;"Functional analysis of dopaminergic systems in a DYT1 knock-in mouse model of dystonia.";68;"Mouse"
1129;"Srivastava, R";0,00;"Blockade of 1-methyl-4-phenylpyridinium ion (MPP+) nigral toxicity in the rat by prior decortication or MK-801 treatment: a stereological estimate of neuronal loss.";64;"Rat"
1130;"Stayte, S";0,00;"Activin A protects midbrain neurons in the 6-hydroxydopamine mouse model of Parkinson's disease.";13;"Mouse"
1131;"Sun, C";0,00;"Allopregnanolone increases the number of dopaminergic neurons in substantia nigra of a triple transgenic mouse model of Alzheimer's disease.";236;"Mouse"
1132;"Sun, X";0,00;"Harpagoside attenuates MPTP/MPP+ induced dopaminergic neurodegeneration and movement disorder via elevating glial cell line-derived neurotrophic factor.";46;"Mouse"
1133;"Taylor, TN";0,00;"Reduced vesicular storage of catecholamines causes progressive degeneration in the locus ceruleus.";59;"Mouse"
1134;"Temel, Y";0,00;"Protection of nigral cell death by bilateral subthalamic nucleus stimulation.";21;"Rat"
1135;"Thiruchelvam, MJ";0,00;"Risk factors for dopaminergic neuron loss in human alpha-synuclein transgenic mice.";2;"Mouse"
1136;"Tiwari, M";0,00;"A knockout of the caspase 2 gene produces increased resistance of the nigrostriatal dopaminergic pathway to MPTP-induced toxicity.";18;"Mouse"
1137;"van Bregt, DR";0,00;"Substantia nigra vulnerability after a single moderate diffuse brain injury in the rat.";18;"Rat"
1138;"Viaggi, C";0,00;"MPTP-induced model of Parkinson's disease in cytochrome P450 2E1 knockout mice.";59;"Mouse"
1139;"Vidyadhara, DJ";0,00;"Admixing of MPTP-Resistant and Susceptible Mice Strains Augments Nigrostriatal Neuronal Correlates to Resist MPTP-Induced Neurodegeneration.";158;"Mouse"
1140;"Vivacqua, G";0,00;"Loss of spinal motor neurons and alteration of alpha-synuclein immunostaining in MPTP induced Parkinsonism in mice.";14;"Mouse"
